{
  "$schema":"https://json-schema.org/draft/2020-12/schema","$id":"https://agent-browser.local/contracts/p158-dashboard-fixtures.v1.schema.json","title":"Plan 0158 synthetic dashboard fixtures",
  "type":"object","required":["schemaVersion","planId","syntheticOnly","baseline","fixtures"],
  "properties":{"schemaVersion":{"const":"agent-browser.p158-dashboard-fixtures.v1"},"planId":{"const":"P158"},"syntheticOnly":{"const":true},"baseline":{"$ref":"#/$defs/fixture"},"fixtures":{"type":"array","minItems":1,"items":{"$ref":"#/$defs/caseSpec"}}},"additionalProperties":false,
  "$defs":{
    "id":{"type":"string","minLength":1,"maxLength":200},"count":{"type":"integer","minimum":0},
    "findingCode":{"enum":["missing_rail_row","duplicate_rail_row","stale_rail_row","wrong_rail_row","rail_order_mismatch","rail_label_mismatch","rail_badge_mismatch","rail_count_mismatch","unstable_same_label_identity","selected_record_mismatch","inspector_record_mismatch","multi_client_selection_leakage","selection_recovery_invalid","deep_link_recovery_invalid","wrong_action_target","action_eligibility_mismatch","ineligible_action_exposed","warning_axis_conflated","warning_axis_mismatch","convergence_action_count_invalid","internal_handoff_url","stale_stream_ready","stream_not_converged","console_error","network_failure","accessibility_defect","focus_defect","keyboard_defect","native_modal_used","overflow_defect","reduced_motion_defect","viewport_defect","latency_budget_exceeded","heap_growth_exceeded","dom_growth_exceeded","listener_growth_exceeded","cpu_growth_exceeded","network_growth_exceeded","long_task_growth_exceeded","browser_process_growth_exceeded","xvfb_process_growth_exceeded","route_growth_exceeded","profile_lease_growth_exceeded","retained_session_growth_exceeded","unresolved_job_growth_exceeded","capture_gap"]},
    "fixture":{"type":"object","required":["fixtureId","description","density","truth","railRows","selection","clientSelections","actions","warnings","handoffUrls","stream","consoleEntries","networkEntries","uiChecks","timings","resourceSlopeBudgets","resourceSamples","captureGaps","expectedFindingCodes"],"properties":{
      "fixtureId":{"$ref":"#/$defs/id"},"description":{"type":"string","minLength":1},"density":{"enum":["empty","sparse","normal","dense"]},"generator":{"$ref":"#/$defs/generator"},
      "truth":{"$ref":"#/$defs/truth"},"railRows":{"type":"array","items":{"$ref":"#/$defs/railRow"}},"selection":{"$ref":"#/$defs/selection"},"clientSelections":{"type":"array","items":{"$ref":"#/$defs/clientSelection"}},"actions":{"type":"array","items":{"$ref":"#/$defs/action"}},"warnings":{"$ref":"#/$defs/warnings"},
      "handoffUrls":{"type":"array","items":{"type":"string","minLength":1}},"stream":{"$ref":"#/$defs/stream"},"consoleEntries":{"type":"array","items":{"$ref":"#/$defs/consoleEntry"}},"networkEntries":{"type":"array","items":{"$ref":"#/$defs/networkEntry"}},"uiChecks":{"type":"array","items":{"$ref":"#/$defs/uiCheck"}},"timings":{"type":"array","items":{"$ref":"#/$defs/timing"}},"resourceSlopeBudgets":{"$ref":"#/$defs/resourceSlopeBudgets"},"resourceSamples":{"type":"array","items":{"$ref":"#/$defs/resourceSample"}},"captureGaps":{"type":"array","items":{"$ref":"#/$defs/captureGap"}},"expectedFindingCodes":{"type":"array","uniqueItems":true,"items":{"$ref":"#/$defs/findingCode"}}
    },"additionalProperties":false},
    "caseSpec":{"type":"object","required":["fixtureId","description","density","mutation","expectedFindingCodes"],"properties":{"fixtureId":{"$ref":"#/$defs/id"},"description":{"type":"string","minLength":1},"density":{"enum":["empty","sparse","normal","dense"]},"mutation":{"$ref":"#/$defs/mutation"},"expectedFindingCodes":{"type":"array","uniqueItems":true,"items":{"$ref":"#/$defs/findingCode"}}},"additionalProperties":false},
    "mutation":{"oneOf":[
      {"type":"object","required":["kind","parameters"],"properties":{"kind":{"const":"inventory_density"},"parameters":{"type":"object","required":["profiles","browsers","tabs","jobs","events"],"properties":{"generatorVersion":{"const":"p158-dashboard-dense.v1"},"seed":{"type":"integer","minimum":0},"profiles":{"$ref":"#/$defs/count"},"browsers":{"$ref":"#/$defs/count"},"tabs":{"$ref":"#/$defs/count"},"jobs":{"$ref":"#/$defs/count"},"events":{"$ref":"#/$defs/count"},"idNamespace":{"$ref":"#/$defs/id"},"labelCardinality":{"type":"integer","minimum":1}},"additionalProperties":false}},"additionalProperties":false},
      {"type":"object","required":["kind","parameters"],"properties":{"kind":{"const":"typed_convergence_warning"},"parameters":{"type":"object","maxProperties":0}},"additionalProperties":false},
      {"type":"object","required":["kind","parameters"],"properties":{"kind":{"$ref":"#/$defs/findingCode"},"parameters":{"type":"object","required":["targetId","ordinal"],"properties":{"targetId":{"$ref":"#/$defs/id"},"ordinal":{"type":"integer","minimum":1},"clientAId":{"$ref":"#/$defs/id"},"clientBId":{"$ref":"#/$defs/id"},"expectedClientAResourceId":{"$ref":"#/$defs/id"},"expectedClientBResourceId":{"$ref":"#/$defs/id"}},"additionalProperties":false}},"additionalProperties":false}
    ]},
    "generator":{"type":"object","required":["generatorVersion","seed","profiles","browsers","tabs","jobs","events","idNamespace","labelCardinality"],"properties":{"generatorVersion":{"const":"p158-dashboard-dense.v1"},"seed":{"type":"integer","minimum":0},"profiles":{"$ref":"#/$defs/count"},"browsers":{"$ref":"#/$defs/count"},"tabs":{"$ref":"#/$defs/count"},"jobs":{"$ref":"#/$defs/count"},"events":{"$ref":"#/$defs/count"},"idNamespace":{"$ref":"#/$defs/id"},"labelCardinality":{"type":"integer","minimum":1}},"additionalProperties":false},
    "truth":{"type":"object","required":["snapshotRevision","counts","resources"],"properties":{"snapshotRevision":{"type":"integer","minimum":0},"counts":{"type":"object","required":["profiles","browsers","tabs","jobs","events"],"properties":{"profiles":{"$ref":"#/$defs/count"},"browsers":{"$ref":"#/$defs/count"},"tabs":{"$ref":"#/$defs/count"},"jobs":{"$ref":"#/$defs/count"},"events":{"$ref":"#/$defs/count"}},"additionalProperties":false},"resources":{"type":"array","items":{"$ref":"#/$defs/resource"}}},"additionalProperties":false},
    "resource":{"type":"object","required":["resourceId","resourceType","label","state","orderKey","badge","count","rowExpected"],"properties":{"resourceId":{"$ref":"#/$defs/id"},"resourceType":{"enum":["profile","browser","tab","job","event","historical_browser"]},"label":{"type":"string"},"state":{"type":"string","minLength":1},"orderKey":{"type":"integer"},"badge":{"type":["string","null"]},"count":{"type":"integer","minimum":0},"rowExpected":{"type":"boolean"}},"additionalProperties":false},
    "railRow":{"type":"object","required":["rowId","resourceId","resourceType","label","state","orderKey","badge","count","snapshotRevision"],"properties":{"rowId":{"$ref":"#/$defs/id"},"resourceId":{"$ref":"#/$defs/id"},"resourceType":{"enum":["profile","browser","tab","job","event","historical_browser"]},"label":{"type":"string"},"state":{"type":"string","minLength":1},"orderKey":{"type":"integer"},"badge":{"type":["string","null"]},"count":{"type":"integer","minimum":0},"snapshotRevision":{"type":"integer","minimum":0}},"additionalProperties":false},
    "selection":{"type":"object","required":["selectedResourceId","inspectorResourceId","selectedExists","recoveryActionCount","deepLinkRequestedId","deepLinkResolvedId"],"properties":{"selectedResourceId":{"type":["string","null"],"minLength":1},"inspectorResourceId":{"type":["string","null"],"minLength":1},"selectedExists":{"type":"boolean"},"recoveryActionCount":{"type":"integer","minimum":0},"deepLinkRequestedId":{"type":["string","null"],"minLength":1},"deepLinkResolvedId":{"type":["string","null"],"minLength":1}},"additionalProperties":false},
    "clientSelection":{"type":"object","required":["clientId","expectedSelectedResourceId","observedSelectedResourceId","expectedInspectorResourceId","observedInspectorResourceId"],"properties":{"clientId":{"$ref":"#/$defs/id"},"expectedSelectedResourceId":{"type":["string","null"],"minLength":1},"observedSelectedResourceId":{"type":["string","null"],"minLength":1},"expectedInspectorResourceId":{"type":["string","null"],"minLength":1},"observedInspectorResourceId":{"type":["string","null"],"minLength":1}},"additionalProperties":false},
    "action":{"type":"object","required":["actionId","declaredTargetResourceId","invokedTargetResourceId","eligible","displayedEligible","rendered"],"properties":{"actionId":{"$ref":"#/$defs/id"},"declaredTargetResourceId":{"$ref":"#/$defs/id"},"invokedTargetResourceId":{"type":["string","null"],"minLength":1},"eligible":{"type":"boolean"},"displayedEligible":{"type":"boolean"},"rendered":{"type":"boolean"}},"additionalProperties":false},
    "warnings":{"type":"object","required":["runtimeHealth","convergenceHealth","accessHealth","acquisitionHealth","displayedAxes","convergenceActionIds"],"properties":{"runtimeHealth":{"enum":["healthy","degraded","failed","unknown"]},"convergenceHealth":{"enum":["healthy","degraded","failed","unknown"]},"accessHealth":{"enum":["healthy","degraded","failed","unknown"]},"acquisitionHealth":{"enum":["healthy","degraded","failed","unknown"]},"displayedAxes":{"type":"array","uniqueItems":true,"items":{"enum":["runtime","convergence","access","acquisition"]}},"convergenceActionIds":{"type":"array","uniqueItems":true,"items":{"$ref":"#/$defs/id"}}},"additionalProperties":false},
    "stream":{"type":"object","required":["snapshotRevision","streamRevision","displayedReady","authoritativeReady"],"properties":{"snapshotRevision":{"type":"integer","minimum":0},"streamRevision":{"type":"integer","minimum":0},"displayedReady":{"type":"boolean"},"authoritativeReady":{"type":"boolean"}},"additionalProperties":false},
    "evidenceClassification":{"type":"object","required":["disposition","code","recoveryEvidenceEntryIds"],"properties":{"disposition":{"enum":["success","expected_lifecycle_noise","actionable_failure"]},"code":{"type":"string","minLength":1,"maxLength":200},"recoveryEvidenceEntryIds":{"type":"array","uniqueItems":true,"items":{"$ref":"#/$defs/id"}}},"additionalProperties":false},
    "consoleEntry":{"type":"object","required":["entryId","level","message"],"properties":{"entryId":{"$ref":"#/$defs/id"},"level":{"enum":["debug","info","warning","error"]},"message":{"type":"string"},"timestamp":{"type":["string","null"],"format":"date-time"},"classification":{"$ref":"#/$defs/evidenceClassification"}},"additionalProperties":false},
    "networkEntry":{"type":"object","required":["entryId","url","status","error"],"properties":{"entryId":{"$ref":"#/$defs/id"},"url":{"type":"string","minLength":1},"status":{"type":["integer","null"],"minimum":100,"maximum":599},"error":{"type":["string","null"],"minLength":1},"method":{"type":["string","null"],"minLength":1},"resourceType":{"type":["string","null"],"minLength":1},"requestAction":{"type":["string","null"],"minLength":1},"pathClass":{"type":["string","null"],"minLength":1},"startedAt":{"type":["string","null"],"format":"date-time"},"completedAt":{"type":["string","null"],"format":"date-time"},"durationMs":{"type":["number","null"],"minimum":0},"redirectCount":{"type":["integer","null"],"minimum":0},"urlSha256":{"type":["string","null"],"pattern":"^[a-f0-9]{64}$"},"classification":{"$ref":"#/$defs/evidenceClassification"}},"additionalProperties":false},
    "uiCheck":{"type":"object","required":["checkId","kind","state","viewportWidth","viewportHeight","detail"],"properties":{"checkId":{"$ref":"#/$defs/id"},"kind":{"enum":["accessibility","focus","keyboard","modal","overflow","reduced_motion","viewport"]},"state":{"enum":["passed","failed"]},"viewportWidth":{"type":"integer","minimum":1},"viewportHeight":{"type":"integer","minimum":1},"detail":{"type":["string","null"],"minLength":1}},"additionalProperties":false},
    "timing":{"type":"object","required":["interaction","p50Ms","p95Ms","p99Ms","worstMs","p95BudgetMs"],"properties":{"interaction":{"enum":["inventory_interactive","rail_commit","selected_action_feedback","deep_link","warning_update","navigation","modal_open"]},"p50Ms":{"type":"number","minimum":0},"p95Ms":{"type":"number","minimum":0},"p99Ms":{"type":"number","minimum":0},"worstMs":{"type":"number","minimum":0},"p95BudgetMs":{"type":"number","minimum":0}},"additionalProperties":false},
    "resourceSlopeBudgets":{"type":"object","required":["heapBytesPerMinute","domNodesPerMinute","listenersPerMinute","cpuMillisecondsPerMinute","networkBytesPerMinute","longTasksPerMinute","browserProcessesPerMinute","xvfbProcessesPerMinute","routeAllocationsPerMinute","profileLeasesPerMinute","retainedSessionsPerMinute","unresolvedJobsPerMinute"],"properties":{"heapBytesPerMinute":{"type":"number","minimum":0},"domNodesPerMinute":{"type":"number","minimum":0},"listenersPerMinute":{"type":"number","minimum":0},"cpuMillisecondsPerMinute":{"type":"number","minimum":0},"networkBytesPerMinute":{"type":"number","minimum":0},"longTasksPerMinute":{"type":"number","minimum":0},"browserProcessesPerMinute":{"type":"number","minimum":0},"xvfbProcessesPerMinute":{"type":"number","minimum":0},"routeAllocationsPerMinute":{"type":"number","minimum":0},"profileLeasesPerMinute":{"type":"number","minimum":0},"retainedSessionsPerMinute":{"type":"number","minimum":0},"unresolvedJobsPerMinute":{"type":"number","minimum":0}},"additionalProperties":false},
    "resourceSample":{"type":"object","required":["elapsedMs","heapBytes","domNodeCount","listenerCount","cpuMilliseconds","networkBytes","longTaskCount","browserProcessCount","xvfbProcessCount","routeAllocationCount","profileLeaseCount","retainedSessionCount","unresolvedJobCount"],"properties":{"elapsedMs":{"type":"integer","minimum":0},"heapBytes":{"$ref":"#/$defs/count"},"domNodeCount":{"$ref":"#/$defs/count"},"listenerCount":{"$ref":"#/$defs/count"},"cpuMilliseconds":{"type":"number","minimum":0},"networkBytes":{"$ref":"#/$defs/count"},"longTaskCount":{"$ref":"#/$defs/count"},"browserProcessCount":{"$ref":"#/$defs/count"},"xvfbProcessCount":{"$ref":"#/$defs/count"},"routeAllocationCount":{"$ref":"#/$defs/count"},"profileLeaseCount":{"$ref":"#/$defs/count"},"retainedSessionCount":{"$ref":"#/$defs/count"},"unresolvedJobCount":{"$ref":"#/$defs/count"}},"additionalProperties":false},
    "captureGap":{"type":"object","required":["gapId","evidenceClass","detail"],"properties":{"gapId":{"$ref":"#/$defs/id"},"evidenceClass":{"enum":["dom","accessibility","screenshot","network","console","performance","resource"]},"detail":{"type":"string","minLength":1}},"additionalProperties":false}
  }
}
