{
  "schemaVersion": "agent-browser.p158-dashboard-fixtures.v1",
  "planId": "P158",
  "syntheticOnly": true,
  "baseline": {
    "fixtureId": "dashboard-baseline",
    "description": "Synthetic healthy dashboard baseline used by the deterministic case generator.",
    "density": "normal",
    "generator": {
      "generatorVersion": "p158-dashboard-dense.v1",
      "seed": 158,
      "profiles": 1,
      "browsers": 1,
      "tabs": 1,
      "jobs": 1,
      "events": 1,
      "idNamespace": "p158-baseline",
      "labelCardinality": 1
    },
    "truth": {
      "snapshotRevision": 10,
      "counts": {
        "profiles": 1,
        "browsers": 1,
        "tabs": 1,
        "jobs": 1,
        "events": 1
      },
      "resources": [
        {
          "resourceId": "browser-001",
          "resourceType": "browser",
          "label": "Shared Browser",
          "state": "ready",
          "orderKey": 1,
          "badge": "ready",
          "count": 1,
          "rowExpected": true
        }
      ]
    },
    "railRows": [
      {
        "rowId": "row-browser-001",
        "resourceId": "browser-001",
        "resourceType": "browser",
        "label": "Shared Browser",
        "state": "ready",
        "orderKey": 1,
        "badge": "ready",
        "count": 1,
        "snapshotRevision": 10
      }
    ],
    "selection": {
      "selectedResourceId": "browser-001",
      "inspectorResourceId": "browser-001",
      "selectedExists": true,
      "recoveryActionCount": 1,
      "deepLinkRequestedId": "browser-001",
      "deepLinkResolvedId": "browser-001"
    },
    "clientSelections": [
      {"clientId":"external-client-a","expectedSelectedResourceId":"browser-001","observedSelectedResourceId":"browser-001","expectedInspectorResourceId":"browser-001","observedInspectorResourceId":"browser-001"},
      {"clientId":"external-client-b","expectedSelectedResourceId":"browser-001","observedSelectedResourceId":"browser-001","expectedInspectorResourceId":"browser-001","observedInspectorResourceId":"browser-001"}
    ],
    "actions": [
      {
        "actionId": "open-view",
        "declaredTargetResourceId": "browser-001",
        "invokedTargetResourceId": "browser-001",
        "eligible": true,
        "displayedEligible": true,
        "rendered": true
      }
    ],
    "warnings": {
      "runtimeHealth": "healthy",
      "convergenceHealth": "healthy",
      "accessHealth": "healthy",
      "acquisitionHealth": "healthy",
      "displayedAxes": [],
      "convergenceActionIds": []
    },
    "handoffUrls": [
      "https://remote.example.test/remote-view/handoff-dashboard"
    ],
    "stream": {
      "snapshotRevision": 10,
      "streamRevision": 10,
      "displayedReady": true,
      "authoritativeReady": true
    },
    "consoleEntries": [],
    "networkEntries": [],
    "uiChecks": [
      {
        "checkId": "ui-accessibility",
        "kind": "accessibility",
        "state": "passed",
        "viewportWidth": 390,
        "viewportHeight": 844,
        "detail": null
      },
      {
        "checkId": "ui-focus",
        "kind": "focus",
        "state": "passed",
        "viewportWidth": 1440,
        "viewportHeight": 900,
        "detail": null
      },
      {
        "checkId": "ui-keyboard",
        "kind": "keyboard",
        "state": "passed",
        "viewportWidth": 390,
        "viewportHeight": 844,
        "detail": null
      },
      {
        "checkId": "ui-modal",
        "kind": "modal",
        "state": "passed",
        "viewportWidth": 1440,
        "viewportHeight": 900,
        "detail": null
      },
      {
        "checkId": "ui-overflow",
        "kind": "overflow",
        "state": "passed",
        "viewportWidth": 390,
        "viewportHeight": 844,
        "detail": null
      },
      {
        "checkId": "ui-reduced_motion",
        "kind": "reduced_motion",
        "state": "passed",
        "viewportWidth": 1440,
        "viewportHeight": 900,
        "detail": null
      },
      {
        "checkId": "ui-viewport",
        "kind": "viewport",
        "state": "passed",
        "viewportWidth": 390,
        "viewportHeight": 844,
        "detail": null
      }
    ],
    "timings": [
      {
        "interaction": "inventory_interactive",
        "p50Ms": 500,
        "p95Ms": 1200,
        "p99Ms": 1500,
        "worstMs": 1800,
        "p95BudgetMs": 3000
      }
    ],
    "resourceSlopeBudgets": {
      "heapBytesPerMinute": 1000000,
      "domNodesPerMinute": 100,
      "listenersPerMinute": 10,
      "cpuMillisecondsPerMinute": 1000,
      "networkBytesPerMinute": 100000,
      "longTasksPerMinute": 2,
      "browserProcessesPerMinute": 0,
      "xvfbProcessesPerMinute": 0,
      "routeAllocationsPerMinute": 0,
      "profileLeasesPerMinute": 0,
      "retainedSessionsPerMinute": 0,
      "unresolvedJobsPerMinute": 0
    },
    "resourceSamples": [
      {
        "elapsedMs": 0,
        "heapBytes": 10000000,
        "domNodeCount": 1000,
        "listenerCount": 100,
        "cpuMilliseconds": 0,
        "networkBytes": 0,
        "longTaskCount": 0,
        "browserProcessCount": 1,
        "xvfbProcessCount": 1,
        "routeAllocationCount": 1,
        "profileLeaseCount": 1,
        "retainedSessionCount": 1,
        "unresolvedJobCount": 0
      },
      {
        "elapsedMs": 60000,
        "heapBytes": 10010000,
        "domNodeCount": 1000,
        "listenerCount": 100,
        "cpuMilliseconds": 100,
        "networkBytes": 1000,
        "longTaskCount": 0,
        "browserProcessCount": 1,
        "xvfbProcessCount": 1,
        "routeAllocationCount": 1,
        "profileLeaseCount": 1,
        "retainedSessionCount": 1,
        "unresolvedJobCount": 0
      }
    ],
    "captureGaps": [],
    "expectedFindingCodes": []
  },
  "fixtures": [
    {
      "fixtureId": "inventory-empty",
      "description": "Clean empty authoritative inventory.",
      "density": "empty",
      "mutation": {
        "kind": "inventory_density",
        "parameters": {
          "profiles": 0,
          "browsers": 0,
          "tabs": 0,
          "jobs": 0,
          "events": 0
        }
      },
      "expectedFindingCodes": []
    },
    {
      "fixtureId": "inventory-sparse",
      "description": "Clean sparse authoritative inventory.",
      "density": "sparse",
      "mutation": {
        "kind": "inventory_density",
        "parameters": {
          "profiles": 1,
          "browsers": 1,
          "tabs": 2,
          "jobs": 3,
          "events": 4
        }
      },
      "expectedFindingCodes": []
    },
    {
      "fixtureId": "inventory-normal",
      "description": "Clean normal authoritative inventory.",
      "density": "normal",
      "mutation": {
        "kind": "inventory_density",
        "parameters": {
          "profiles": 10,
          "browsers": 25,
          "tabs": 100,
          "jobs": 500,
          "events": 500
        }
      },
      "expectedFindingCodes": []
    },
    {
      "fixtureId": "inventory-dense",
      "description": "Clean deterministic dense inventory at the required scale.",
      "density": "dense",
      "mutation": {
        "kind": "inventory_density",
        "parameters": {
          "generatorVersion": "p158-dashboard-dense.v1",
          "seed": 158,
          "profiles": 100,
          "browsers": 500,
          "tabs": 2000,
          "jobs": 10000,
          "events": 10000,
          "idNamespace": "p158-dense",
          "labelCardinality": 8
        }
      },
      "expectedFindingCodes": []
    },
    {
      "fixtureId": "warning-typed-convergence-clean",
      "description": "Typed convergence failure displays only the convergence axis and exactly one executable action.",
      "density": "normal",
      "mutation": {
        "kind": "typed_convergence_warning",
        "parameters": {}
      },
      "expectedFindingCodes": []
    },
    {
      "fixtureId": "defect-missing-rail-row",
      "description": "Isolated synthetic missing rail row defect.",
      "density": "normal",
      "mutation": {
        "kind": "missing_rail_row",
        "parameters": {
          "targetId": "browser-001",
          "ordinal": 1
        }
      },
      "expectedFindingCodes": [
        "missing_rail_row"
      ]
    },
    {
      "fixtureId": "defect-duplicate-rail-row",
      "description": "Isolated synthetic duplicate rail row defect.",
      "density": "normal",
      "mutation": {
        "kind": "duplicate_rail_row",
        "parameters": {
          "targetId": "browser-001",
          "ordinal": 2
        }
      },
      "expectedFindingCodes": [
        "duplicate_rail_row"
      ]
    },
    {
      "fixtureId": "defect-stale-rail-row",
      "description": "Isolated synthetic stale rail row defect.",
      "density": "normal",
      "mutation": {
        "kind": "stale_rail_row",
        "parameters": {
          "targetId": "browser-001",
          "ordinal": 3
        }
      },
      "expectedFindingCodes": [
        "stale_rail_row"
      ]
    },
    {
      "fixtureId": "defect-wrong-rail-row",
      "description": "Isolated synthetic wrong rail row defect.",
      "density": "normal",
      "mutation": {
        "kind": "wrong_rail_row",
        "parameters": {
          "targetId": "browser-001",
          "ordinal": 4
        }
      },
      "expectedFindingCodes": [
        "wrong_rail_row"
      ]
    },
    {
      "fixtureId": "defect-rail-order-mismatch",
      "description": "Isolated synthetic rail order mismatch defect.",
      "density": "normal",
      "mutation": {
        "kind": "rail_order_mismatch",
        "parameters": {
          "targetId": "browser-001",
          "ordinal": 5
        }
      },
      "expectedFindingCodes": [
        "rail_order_mismatch"
      ]
    },
    {
      "fixtureId": "defect-rail-label-mismatch",
      "description": "Isolated synthetic rail label mismatch defect.",
      "density": "normal",
      "mutation": {